{"generated_at":"2026-06-26T17:27:30.056732+00:00","source":{"name":"Canadian Pedestrian Network Database","catalogue":"34260004","license":"Open Government Licence - Canada","collected":"2023-11 to 2024-02"},"provinces":{"ab":{"name":"Alberta","covered":true,"municipality_count":5},"bc":{"name":"British Columbia","covered":true,"municipality_count":14},"mb":{"name":"Manitoba","covered":true,"municipality_count":1},"nb":{"name":"New Brunswick","covered":true,"municipality_count":3},"nl":{"name":"Newfoundland and Labrador","covered":false,"municipality_count":0,"gap_narrative":"No municipality in Newfoundland and Labrador has published open pedestrian infrastructure data that Statistics Canada's 2023-2024 harvest could find."},"ns":{"name":"Nova Scotia","covered":true,"municipality_count":1},"nt":{"name":"Northwest Territories","covered":false,"municipality_count":0,"gap_narrative":"No municipality in the Northwest Territories has published open pedestrian infrastructure data that Statistics Canada's 2023-2024 harvest could find."},"nu":{"name":"Nunavut","covered":false,"municipality_count":0,"gap_narrative":"No municipality in Nunavut has published open pedestrian infrastructure data that Statistics Canada's 2023-2024 harvest could find."},"on":{"name":"Ontario","covered":true,"municipality_count":23},"pe":{"name":"Prince Edward Island","covered":false,"municipality_count":0,"gap_narrative":"No municipality in Prince Edward Island has published open pedestrian infrastructure data that Statistics Canada's 2023-2024 harvest could find. This doesn't mean none exists -- it means nobody has confirmed it publicly yet."},"qc":{"name":"Quebec","covered":true,"municipality_count":5},"sk":{"name":"Saskatchewan","covered":true,"municipality_count":2},"yt":{"name":"Yukon","covered":false,"municipality_count":0,"gap_narrative":"No municipality in Yukon has published open pedestrian infrastructure data that Statistics Canada's 2023-2024 harvest could find."}},"municipalities":[{"province_code":"ab","municipality_slug":"airdrie","municipality_name":"Airdrie","csd_uid":"4806021","feature_count":16369,"category_counts":{"Pedestrian Path":15519,"Sidewalk":850},"pct_has_width":0.9333,"pct_has_surface":0.9438,"bbox":[-114.048427,51.249001,-113.970876,51.307414],"sources":[{"file_name":"multi-airdrie-Airdrie_Pathways","source_url":"https://data-airdrie.opendata.arcgis.com/datasets/airdrie::airdrie-pathway/about","licence_url":"https://data-airdrie.opendata.arcgis.com/pages/our-open-licence","attribution_statement":"Contains information licensed under the Open Data Licence \u2013 City of Airdrie.","last_update":"2021"}]},{"province_code":"ab","municipality_slug":"chestermere","municipality_name":"Chestermere","csd_uid":"4806017","feature_count":967,"category_counts":{"Sidewalk":593,"Pedestrian Path":374},"pct_has_width":0.2782,"pct_has_surface":0.7332,"bbox":[-113.855897,51.008873,-113.806078,51.065735],"sources":[{"file_name":"walking-chestermere-Sidewalks","source_url":"https://data-chestermere.opendata.arcgis.com/datasets/23e940e9db3444d7a4e4fa8497597a66_0/explore","licence_url":"https://data-chestermere.opendata.arcgis.com/","attribution_statement":"Contains information made available by the City of Chestermere through their Open Data portal","last_update":"2021"},{"file_name":"multi-chestermere-Pathways","source_url":"https://data-chestermere.opendata.arcgis.com/datasets/pathways","licence_url":"https://data-chestermere.opendata.arcgis.com/","attribution_statement":"Contains information made available by the City of Chestermere through their Open Data portal","last_update":"2021"}]},{"province_code":"ab","municipality_slug":"edmonton","municipality_name":"Edmonton","csd_uid":"4811061","feature_count":552577,"category_counts":{"Sidewalk":552577},"pct_has_width":0.0,"pct_has_surface":0.0,"bbox":[-113.722237,53.395603,-113.249359,53.715905],"sources":[{"file_name":"walking-Edmonton-geo_export_6eacaec4-e505-4b53-95cb-625a24d9dcec","source_url":"https://data.edmonton.ca/Transportation/trails/ws2s-7zrm/data?no_mobile=true","licence_url":"https://data.edmonton.ca/stories/s/City-of-Edmonton-Open-Data-Terms-of-Use/msh8-if28/","attribution_statement":"Contains information licensed under the Open Government Licence \u2013 City of Edmonton","last_update":"2023"}]},{"province_code":"ab","municipality_slug":"okotoks","municipality_name":"Okotoks","csd_uid":"4806012","feature_count":860,"category_counts":{"Multi-use Path":860},"pct_has_width":0.0,"pct_has_surface":0.0,"bbox":[-114.001652,50.703098,-113.929061,50.741905],"sources":[{"file_name":"multi-okotoks","source_url":"https://okotoksmaps-okotoks.hub.arcgis.com/maps/7378fd08b86146048aa9c2789000b9cc","licence_url":"https://okotoksmaps-okotoks.hub.arcgis.com/pages/open-data-licence","attribution_statement":"Contains information licensed under the Open Government Licence - Town of Okotoks","last_update":"2023"}]},{"province_code":"ab","municipality_slug":"saint_albert","municipality_name":"St. Albert","csd_uid":"4811062","feature_count":2000,"category_counts":{"Sidewalk":1939,"Unpaved Path":61},"pct_has_width":1.0,"pct_has_surface":0.9995,"bbox":[-113.676505,53.601917,-113.565918,53.675096],"sources":[{"file_name":"multi-use-Saint Albert-Pathways_and_Sidewalks","source_url":"https://data.stalbert.ca/maps/stalbert::pathways-and-sidewalks","licence_url":"https://data.stalbert.ca/pages/licence","attribution_statement":"Contains information licensed under the Open Data Licence \u2013 City of St. Albert","last_update":"2023"}]},{"province_code":"bc","municipality_slug":"burnaby","municipality_name":"Burnaby","csd_uid":"5915025","feature_count":358,"category_counts":{"Unpaved Path":343,"Pedestrian Path":11,"Bridge or Underpass":4},"pct_has_width":0.8659,"pct_has_surface":0.0615,"bbox":[-123.024356,49.184857,-122.892644,49.289987],"sources":[{"file_name":"multi-use-Burnaby-Urban_Paths__26_Trails","source_url":"https://data.burnaby.ca/datasets/burnaby::urban-paths-trails/explore","licence_url":"https://data.burnaby.ca/pages/open-government-licence","attribution_statement":"Contains information licensed under the Open Government Licence \u2013 City of Burnaby.","last_update":"2022"}]},{"province_code":"bc","municipality_slug":"chilliwack","municipality_name":"Chilliwack","csd_uid":"5909020","feature_count":1591,"category_counts":{"Sidewalk":1591},"pct_has_width":0.0,"pct_has_surface":0.8529,"bbox":[-122.082127,49.078685,-121.801789,49.195313],"sources":[{"file_name":"Sidewalks","source_url":"https://www.chilliwack.com/main/page.cfm?id=2331&odAction=viewItem&odID=162","licence_url":"https://www.chilliwack.com/main/page.cfm?id=2391","attribution_statement":"Contains information made available by the City of Chilliwack through their Open Data portal","last_update":"2023"}]},{"province_code":"bc","municipality_slug":"coquitlam","municipality_name":"Coquitlam","csd_uid":"5915034","feature_count":4517,"category_counts":{"Sidewalk":4143,"Pedestrian Path":196,"Multi-use Path":118,"Unpaved Path":59,"Stairway":1},"pct_has_width":0.9179,"pct_has_surface":0.9845,"bbox":[-122.89352,49.222517,-122.728184,49.320882],"sources":[{"file_name":"walking-Coquitlam-Sidewalks","source_url":"https://data.coquitlam.ca/datasets/Coquitlam::sidewalks-1/about","licence_url":"https://www.coquitlam.ca/894/Open-Government-Licence","attribution_statement":"Contains information licensed under the Open Government Licence \u2013 Coquitlam.","last_update":"2023"},{"file_name":"walking-Coquitlam-Walkways","source_url":"https://data.coquitlam.ca/datasets/Coquitlam::transportation-1/about?layer=12","licence_url":"https://www.coquitlam.ca/894/Open-Government-Licence","attribution_statement":"Contains information licensed under the Open Government Licence \u2013 Coquitlam.","last_update":"2023"}]},{"province_code":"bc","municipality_slug":"kamloops","municipality_name":"Kamloops","csd_uid":"5933042","feature_count":3020,"category_counts":{"Sidewalk":3020},"pct_has_width":0.9907,"pct_has_surface":1.0,"bbox":[-120.426054,50.631369,-120.08242,50.800896],"sources":[{"file_name":"walking-kamloops-Sidewalk","source_url":"https://maps.kamloops.ca/arcgis/rest/services/OpenData/OpenDataPlanimetric/MapServer/25","licence_url":"https://www.kamloops.ca/node/29807","attribution_statement":"Contains information licensed under the Open Government Licence - Kamloops","last_update":"2021"}]},{"province_code":"bc","municipality_slug":"kelowna","municipality_name":"Kelowna","csd_uid":"5935010","feature_count":4233,"category_counts":{"Sidewalk":3675,"Multi-use Path":273,"Pedestrian Path":214,"Unpaved Path":71},"pct_has_width":0.0149,"pct_has_surface":0.0451,"bbox":[-119.526894,49.781271,-119.3371,50.023143],"sources":[{"file_name":"multi-use-Kelowna-Active_Transportation_Network","source_url":"https://opendata.kelowna.ca/datasets/kelowna::active-transportation-network/about","licence_url":"https://apps.kelowna.ca/images/opendata/OpenGovernmentLicence.pdf","attribution_statement":"Contains information licensed under the Open Government Licence \u2013 City of Kelowna.","last_update":"2016"},{"file_name":"walking-Kelowna-Walkway","source_url":"https://opendata.kelowna.ca/datasets/walkway/explore","licence_url":"https://apps.kelowna.ca/images/opendata/OpenGovernmentLicence.pdf","attribution_statement":"Contains information licensed under the Open Government Licence \u2013 City of Kelowna.","last_update":"2016"}]},{"province_code":"bc","municipality_slug":"maple_ridge","municipality_name":"Maple Ridge","csd_uid":"5915075","feature_count":2835,"category_counts":{"Sidewalk":2703,"Pedestrian Path":132},"pct_has_width":0.0,"pct_has_surface":0.0,"bbox":[-122.669277,49.172344,-122.422905,49.256607],"sources":[{"file_name":"walking-Maple Ridge-Sidewalks","source_url":"https://www.arcgis.com/home/item.html?id=f9f30657f7d0403bb93fbadd95c1aaf4","licence_url":"https://www.mapleridge.ca/terms-use","attribution_statement":"Contains information licensed under the Open Governmen